Station code,Name of the Monitoring Location,State Name,Temperature 0 C_min,Temperature 0 C_max,Dissolved Oxygen mg L_min,Dissolved Oxygen mg L_MAX,pH6.5 MIN,pH6.5 MAX,Conductivity µmho cm MIN,conductivity µmho cm MAX,Bio-chemical Oxygen Demand mg L,Bio-chemical Oxygen Demand mg L MAX,Nitrate mg L MIN,Nitrate mgL MAX,Fecal Coliform MIN,Fecacal coliform MAX,Total Coliform MPN 100 mL MIN,Total Coliform MPN 100 mL2 MAX,Year,aquatic_score,water_type,pH_category
1867,RIVER     SUTLEJ     BEFORE CONF.   WITH  RIVER  SPITI AT KHAB,HIMACHAL PRADESH,7.0,14.0,8.9,9.4,8.02,8.42,288.0,467.0,2.6251969852689276,5.892971727105102,0.32,0.61,6.0,20.0,8.0,1600.0,2022,3,Good,Neutral (6.5–8.5)
2611,"RIVER       SUTLEJ       AFTER CONF.   WITH   RIVER   SPIT
AT KHAB",HIMACHAL PRADESH,7.0,13.0,9.0,9.5,8.05,8.56,255.0,471.0,2.6251969852689276,5.892971727105102,0.32,0.65,4.0,24.0,110.0,1600.0,2022,2,Moderate,Neutral (6.5–8.5)
3872,RIVER SUTLEJ D/S TIDONG HEP,HIMACHAL PRADESH,6.5,13.0,8.8,9.4,8.1,8.56,290.0,2137.0,2.6251969852689276,5.892971727105102,0.32,0.59,2.0,17.0,110.0,1600.0,2022,2,Moderate,Neutral (6.5–8.5)
4448,"RIVER     SUTLEJ     BEFORE
CONFLUENCES            WITH RIVER TIDONG",HIMACHAL PRADESH,6.0,13.0,8.9,9.4,8.06,8.52,278.0,3392.0,2.6251969852689276,5.892971727105102,0.32,0.62,4.0,38.0,2.0,350.0,2022,2,Moderate,Neutral (6.5–8.5)
4449,RIVER       SUTLEJ       AFTER CONFLUENCES            WITH RIVER TIDONG,HIMACHAL PRADESH,6.5,13.0,8.8,9.4,8.06,8.56,291.0,3970.0,2.6251969852689276,5.892971727105102,0.32,0.58,2.0,170.0,2.0,1600.0,2022,2,Moderate,Neutral (6.5–8.5)
4452,RIVER     SUTLEJ     BEFORE CONFLUENCES   OF   RIVER BASPA,HIMACHAL PRADESH,6.0,13.0,8.7,9.6,8.08,8.53,292.0,2514.0,2.6251969852689276,5.892971727105102,0.32,0.65,2.0,33.0,7.0,1600.0,2022,2,Moderate,Neutral (6.5–8.5)
3871,RIVER SUTLEJ D/S POWER HOUSE KASHANG HEP,HIMACHAL PRADESH,6.0,13.0,8.8,9.3,8.07,8.47,293.0,3157.0,2.6251969852689276,5.892971727105102,0.32,0.6,2.0,22.0,5.0,1600.0,2022,3,Good,Neutral (6.5–8.5)
3870,RIVER       SUTLEJ       AFTER CONF. OF RIVER BASPA AT KARCHAM DAM,HIMACHAL PRADESH,7.0,13.0,8.8,9.2,7.86,8.49,260.0,2441.0,2.6251969852689276,5.892971727105102,0.7343646138807429,0.61,2.0,26.0,4.0,1600.0,2022,3,Good,Neutral (6.5–8.5)
1389,RIVER           SUTLEJ           AT WANGTOO BRIDGE,HIMACHAL PRADESH,7.0,13.0,8.7,9.3,6.74,8.54,83.0,2718.0,2.6251969852689276,5.892971727105102,0.32,2.54,6.0,39.0,39.0,1600.0,2022,2,Moderate,Neutral (6.5–8.5)
4453,"RIVER       SUTLEJ       AFTER
CONFLUENCES   OF   RIVER BASPA",HIMACHAL PRADESH,7.0,13.0,8.8,9.3,6.7,8.46,100.0,1893.0,2.6251969852689276,5.892971727105102,0.32,1.28,2.0,21.0,6.0,1600.0,2022,3,Good,Neutral (6.5–8.5)
3869,RIVER SUTLEJ D/S TRT OF RAMPUR HYDEL ELECTRIC PROJECT,HIMACHAL PRADESH,8.0,14.0,8.6,9.1,7.37,8.31,87.0,2517.0,2.6251969852689276,5.892971727105102,0.32,1.14,2.0,33.0,14.0,1600.0,2022,3,Good,Neutral (6.5–8.5)
1086,RIVER     SUTLEJ     AT     U/S RAMPUR,HIMACHAL PRADESH,8.0,14.0,8.6,9.1,6.97,8.26,82.0,1166.0,2.6251969852689276,5.892971727105102,0.32,1.74,6.0,58.0,32.0,1600.0,2022,3,Good,Neutral (6.5–8.5)
1087,RIVER     SUTLEJ     AT     D/S RAMPUR,HIMACHAL PRADESH,8.0,14.0,8.7,9.2,6.98,8.26,87.0,1257.0,2.6251969852689276,5.892971727105102,0.32,0.87,6.0,47.0,7.0,1600.0,2022,3,Good,Neutral (6.5–8.5)
1013,RIVER     SUTLEJ     AT     U/S TATAPANI,HIMACHAL PRADESH,8.0,14.0,8.4,9.2,7.57,8.3,94.0,2594.0,2.6251969852689276,5.892971727105102,0.32,1.15,4.0,22.0,9.0,1600.0,2022,3,Good,Neutral (6.5–8.5)
4446,RIVER          SUTLEJ          U/S IANDFILL SITE RAMPUR,HIMACHAL PRADESH,7.5,14.0,8.6,9.1,6.85,8.34,86.0,1152.0,2.6251969852689276,5.892971727105102,0.32,4.34,6.0,27.0,14.0,1600.0,2022,3,Good,Neutral (6.5–8.5)
4447,RIVER          SUTLEJ          D/S LANDFILL SITE RAMPUR,HIMACHAL PRADESH,7.5,14.0,8.6,9.1,6.94,8.23,87.0,2489.0,2.6251969852689276,5.892971727105102,0.32,0.82,2.0,350.0,9.0,1600.0,2022,3,Good,Neutral (6.5–8.5)
4032,RIVER    SUTLEJ    D/S    ACC BARMANA,HIMACHAL PRADESH,10.0,28.0,8.9,9.6,7.54,8.4,172.0,430.0,2.6251969852689276,5.892971727105102,0.32,3.99,49.0,220.0,210.0,920.0,2022,3,Good,Neutral (6.5–8.5)
4033,RIVER        SUTLEJ        NEAR LUHNOO GROUND,HIMACHAL PRADESH,10.0,28.0,8.6,9.5,7.44,8.46,162.0,466.0,1.4,1.4,0.32,2.39,94.0,280.0,430.0,920.0,2022,4,Excellent,Neutral (6.5–8.5)
4450,RIVER     SUTLEJ     BEFORE CONFLUENCE WITH GANVI KHAND,HIMACHAL PRADESH,7.5,14.0,8.7,9.4,6.82,8.57,83.0,1176.0,2.6251969852689276,5.892971727105102,0.32,2.81,4.0,94.0,17.0,1600.0,2022,2,Moderate,Neutral (6.5–8.5)
4451,RIVER       SUTLEJ       AFTER CONFLUENCE WITH GANVI KHAD,HIMACHAL PRADESH,7.5,14.0,8.7,9.4,6.83,8.39,86.0,1258.0,2.6251969852689276,5.892971727105102,0.32,3.14,4.0,70.0,6.8,1600.0,2022,3,Good,Neutral (6.5–8.5)
30009,RIVER SUTLEJ AT NANGAL (H.P.),HIMACHAL PRADESH,19.5,20.0,7.9,9.6,7.7,8.5,218.0,271.0,1.4,4.0,0.42,1.42,40.0,54000.0,110.0,206671.80172366623,2022,2,Moderate,Neutral (6.5–8.5)
1014,RIVER SUTLEJ U/S OF EXIT POINT  OF  DEHAR  POWER HOUSE,HIMACHAL PRADESH,10.0,28.0,9.0,9.7,7.76,8.47,126.0,285.0,1.2,1.2,0.32,1.4,31.0,84.0,210.0,350.0,2022,4,Excellent,Neutral (6.5–8.5)
1015,"RIVER SUTLEJ D/S OF EXIT
POINT  OF  DEHAR  POWER HOUSE",HIMACHAL PRADESH,10.0,28.0,8.8,9.7,7.86,8.34,137.0,300.0,2.6251969852689276,5.892971727105102,0.32,2.09,58.0,140.0,280.0,540.0,2022,3,Good,Neutral (6.5–8.5)
1016,RIVER          SUTLEJ          D/S BHAKHRA,HIMACHAL PRADESH,16.0,28.0,8.4,9.4,6.88,7.84,181.0,316.0,2.6251969852689276,5.892971727105102,0.7343646138807429,5.77,2.0,43.0,21.0,220.0,2022,3,Good,Neutral (6.5–8.5)
30087,"RIVER     SUTLEJ     U/S    AT OLINDA,    NEAR    BHAKRA DAM, H.P.",HIMACHAL PRADESH,18.0,21.0,8.5,10.7,8.0,8.3,218.0,249.0,3.0,3.0,0.32,0.42,220.0,3300.0,700.0,17000.0,2022,3,Good,Neutral (6.5–8.5)
30088,"RIVER SUTLEJ D/S OLINDA, NEAR BHAKRA DAM, H.P.",HIMACHAL PRADESH,18.0,21.0,8.4,10.1,8.1,8.3,216.0,243.0,1.3,1.5,0.32,0.42,2.0,680.0,430.0,3300.0,2022,3,Good,Neutral (6.5–8.5)
30010,RIVER           SUTLEJ           AT NOORPUR      BEDI      ROAD (PUNJAB),PUNJAB,18.0,26.0,8.6,9.2,7.7,8.0,237.0,273.0,2.6251969852689276,5.892971727105102,0.42,0.92,110.0,2300.0,700.0,14000.0,2022,2,Moderate,Neutral (6.5–8.5)
1814,"RIVER     SUTLEJ     AT     D/S KIRATPUR SAHIB, PUNJAB",PUNJAB,11.0,25.0,8.0,10.6,7.6,8.5,214.0,321.0,2.6251969852689276,5.892971727105102,1.2,1.8,92.0,250.0,410.0,790.0,2022,3,Good,Neutral (6.5–8.5)
2915,"RIVER  SUTLEJ  AT  100  MT. D/S    OF    PACL,    NANGAL, PUNJAB",PUNJAB,11.0,22.0,8.3,10.7,7.3,8.4,216.0,272.0,2.6251969852689276,5.892971727105102,1.3,1.7,20.0,140.0,140.0,390.0,2022,3,Good,Neutral (6.5–8.5)
1380,"RIVER SUTLEJ AT D/S NFL, PUNJAB",PUNJAB,10.0,22.0,8.4,10.8,7.5,8.4,217.0,270.0,2.6251969852689276,5.892971727105102,1.4,1.7,20.0,100.0,170.0,380.0,2022,3,Good,Neutral (6.5–8.5)
10020,RIVER           SUTLEJ           AT ANANDPUR SAHIB,PUNJAB,12.0,27.0,7.8,10.0,7.4,8.5,235.0,388.0,2.6251969852689276,5.892971727105102,1.3,2.1,78.0,210.0,330.0,580.0,2022,3,Good,Neutral (6.5–8.5)
10021,RIVER  SUTLEJ  AT  BUNGA SAHIB,PUNJAB,10.0,28.005412521942656,5.7971657600916116,11.1,7.4,8.4,217.0,277.0,2.6251969852689276,5.892971727105102,1.3,1.7,130.0,260.0,460.0,790.0,2022,3,Good,Neutral (6.5–8.5)
10022,RIVER           SUTLEJ           AT PHILLAUR U/S,PUNJAB,13.0,32.0,5.6,8.0,7.2,8.3,238.0,522.0,1.6,4.0,0.7343646138807429,1.4,260.0,2200.0,700.0,4900.0,2022,2,Moderate,Neutral (6.5–8.5)
10023,RIVER           SUTLEJ           AT PHAGWARA                      U/S (CHAHERU BRIDGE),PUNJAB,10.0,33.0,2.9,5.8,7.2,8.3,610.0,858.0,8.0,17.0,0.4,2.1,320.0,2100.0,1500.0,6300.0,2022,1,Polluted,Neutral (6.5–8.5)
10024,"RIVER           SUTLEJ           AT PHAGWARA                      D/S
(KANGANIWAL BRIDGE)",PUNJAB,10.0,36.0,1.0,1.4,7.1,8.4,574.0,1265.0,11.0,26.0,0.4,2.4,2100.0,7800.0,6300.0,21000.0,2022,1,Polluted,Neutral (6.5–8.5)
10027,RIVER           SUTLEJ           AT LUDHIANA U/S,PUNJAB,12.0,29.0,7.1,9.2,7.8,8.5,258.0,336.0,1.2,1.2,1.3,2.4,330.0,1400.0,940.0,3400.0,2022,3,Good,Neutral (6.5–8.5)
10028,RIVER           SUTLEJ           AT LUDHIANA D/S,PUNJAB,11.0,31.0,1.0,7.0,7.2,8.0,294.0,1150.0,1.6,39.0,1.4,3.1,33000.0,94402.99494284726,94000.0,206671.80172366623,2022,1,Polluted,Neutral (6.5–8.5)
1017,"RIVER   SUTLEJ   AT   100M
U/S       OF      HEADWORKS, NANGAL",PUNJAB,9.0,21.0,7.2,9.1,7.7,8.2,200.0,241.0,2.6251969852689276,5.892971727105102,1.2,1.8,18.0,130.0,110.0,270.0,2022,3,Good,Neutral (6.5–8.5)
1018,"RIVER   SUTLEJ   AT   100M D/S , NANGAL",PUNJAB,10.0,26.0,7.6,10.5,7.5,8.5,221.0,307.0,2.6251969852689276,5.892971727105102,1.2,1.7,11.0,110.0,170.0,470.0,2022,3,Good,Neutral (6.5–8.5)
1293,"RIVER   SUTLEJ   AT   1   KM.
D/S OF ZENITH, PUNJAB",PUNJAB,10.0,26.0,7.3,9.4,7.6,8.3,229.0,478.0,2.6251969852689276,5.892971727105102,1.2,1.8,320.0,1300.0,840.0,3400.0,2022,2,Moderate,Neutral (6.5–8.5)
1019,RIVER     SUTLEJ     AT     U/S HEAD WORKS ROPAR,PUNJAB,9.0,27.0,7.3,9.6,7.4,8.5,238.0,347.0,2.6251969852689276,5.892971727105102,1.3,1.9,250.0,930.0,580.0,3400.0,2022,2,Moderate,Neutral (6.5–8.5)
1690,"RIVER     SUTLEJ     AT     U/S BUDHA  NALLAH  (UPPER), PUNJAB",PUNJAB,9.0,30.0,6.2,8.0,7.4,8.2,254.0,438.0,1.1,1.4,1.6,2.6,400.0,1700.0,1000.0,4300.0,2022,3,Good,Neutral (6.5–8.5)
1020,"RIVER   SUTLEJ   AT   100M D/S  BUDHA  NALA  CONFL., LUDHIANA",PUNJAB,10.0,32.0,1.1,6.0,7.2,7.7,332.0,1302.0,2.6,140.0,1.6,3.4,70000.0,94402.99494284726,8970.337549488055,206671.80172366623,2022,1,Polluted,Neutral (6.5–8.5)
1022,"RIVER  SUTLEJ  AT  BRIDGE HARIKE, AMRITSAR",PUNJAB,13.0,28.0,4.8,7.6,7.2,8.5,220.0,660.0,1.2,4.0,1.3,2.3,780.0,2100.0,2200.0,5800.0,2022,1,Polluted,Neutral (6.5–8.5)
10025,RIVER           SUTLEJ           AT JALANDHAR   U/S   (PEERU SHAH KA DARGAH),PUNJAB,10.0,37.0,0.0,0.0,6.9,7.9,792.0,1210.0,50.0,85.0,3.0,5.2,33000.0,94402.99494284726,8970.337549488055,206671.80172366623,2022,1,Polluted,Neutral (6.5–8.5)
10026,"RIVER           SUTLEJ           AT JALANDHAR                      D/S
(MALSIAN BRIDGE)",PUNJAB,11.0,36.0,0.0,0.0,7.2,7.8,589.0,1260.0,50.0,87.0,4.6,7.2,22000.0,94402.99494284726,79000.0,206671.80172366623,2022,1,Polluted,Neutral (6.5–8.5)
1021,"RIVER   SUTLEJ   AT   BOAT BDG. DHARMKOTNAKODAR
ROAD, JALANDHAR",PUNJAB,12.0,29.0,1.2,6.2,7.1,8.5,320.0,1023.0,1.4,70.0,1.3,3.0,4600.0,94402.99494284726,70000.0,206671.80172366623,2022,1,Polluted,Neutral (6.5–8.5)
1381,"RIVER SUTLEJ AT D/S EAST BEIN, PUNJAB",PUNJAB,13.0,29.0,1.4,5.8,7.1,8.4,307.0,1045.0,2.5,37.0,1.5,3.3,31000.0,94402.99494284726,84000.0,206671.80172366623,2022,1,Polluted,Neutral (6.5–8.5)
1691,"RIVER     SUTLEJ     AT     U/S HUSSANIWALA      -      H/W
FEROZEPUR, PUNJAB",PUNJAB,11.0,30.0,5.6,8.8,7.2,8.3,232.0,353.0,1.1,1.3,1.2,1.9,250.0,1300.0,580.0,3300.0,2022,3,Good,Neutral (6.5–8.5)
1692,"RIVER     SUTLEJ     AT     D/S HUSSANIWALA-H/W FEROZEPUR, PUNJAB",PUNJAB,12.0,29.0,5.6,8.5,7.2,8.4,234.0,360.0,1.2,1.4,1.2,2.0,180.0,1700.0,610.0,3400.0,2022,3,Good,Neutral (6.5–8.5)
4059,"RIVER RAVI AT RANJIT SAGAR        DAM,        AT PANAGAR (BASOHIL)",JAMMU & KASHMIR,21.0,24.0,7.0,7.6,8.2,8.56,176.0,186.0,2.6251969852689276,5.892971727105102,0.7343646138807429,2.9544753347427766,3538.5852697095434,94402.99494284726,8970.337549488055,206671.80172366623,2022,1,Polluted,Neutral (6.5–8.5)
4060,RIVER  RAVI  AT  DAM- SITE AT THEIN,JAMMU & KASHMIR,21.0,24.0,7.0,7.8,8.0,8.2,162.0,174.0,2.6251969852689276,5.892971727105102,0.7343646138807429,2.9544753347427766,3538.5852697095434,94402.99494284726,8970.337549488055,206671.80172366623,2022,2,Moderate,Neutral (6.5–8.5)
4061,"RIVER         RAVI         AT LAKHANPUR, 1 KM D/S FROM         MADHOPUR
BRIDGE",JAMMU & KASHMIR,22.0,24.0,7.6,7.6,8.1,8.65,186.0,204.0,2.6251969852689276,5.892971727105102,0.7343646138807429,2.9544753347427766,3538.5852697095434,94402.99494284726,8970.337549488055,206671.80172366623,2022,1,Polluted,Neutral (6.5–8.5)
1088,RIVER   RAVI   AT   U/S MADHOPUR,HIMACHAL PRADESH,13.0,27.0,6.2,9.1,7.13,7.86,161.0,305.0,2.6251969852689276,5.892971727105102,0.7343646138807429,4.41,2.0,22.0,21.0,1600.0,2022,3,Good,Neutral (6.5–8.5)
1089,RIVER        RAVI        U/S CHAMBA,HIMACHAL PRADESH,10.0,18.0,8.4,9.4,7.18,7.94,142.0,248.0,2.6251969852689276,5.892971727105102,0.7343646138807429,2.68,2.0,13.0,17.0,920.0,2022,3,Good,Neutral (6.5–8.5)
2614,"RIVER                       RAVI
CHAMERA-I RESERVOIR",HIMACHAL PRADESH,9.0,19.0,8.7,9.2,6.92,8.09,146.0,334.0,2.6251969852689276,5.892971727105102,0.7343646138807429,3.68,2.0,26.0,21.0,1600.0,2022,3,Good,Neutral (6.5–8.5)
2615,RIVER     RAVI          D/S CHAMERA-     III     HEP DAM,HIMACHAL PRADESH,9.0,18.0,8.6,9.4,7.04,8.31,96.0,216.0,2.6251969852689276,5.892971727105102,0.7343646138807429,3.26,2.0,33.0,21.0,540.0,2022,3,Good,Neutral (6.5–8.5)
2613,RIVER RAVI AT D/S OF CHAMBA TOWN,HIMACHAL PRADESH,10.0,17.0,8.2,9.4,7.24,8.05,154.0,225.0,2.6251969852689276,5.892971727105102,0.7343646138807429,6.06,2.0,84.0,24.0,1600.0,2022,3,Good,Neutral (6.5–8.5)
3873,RIVER   RAVI   U/S   STP AT BHARGA,HIMACHAL PRADESH,10.0,18.0,8.1,9.4,7.13,8.21,136.0,204.0,2.6251969852689276,5.892971727105102,0.7343646138807429,5.19,2.0,22.0,24.0,170.0,2022,3,Good,Neutral (6.5–8.5)
3874,RIVER   RAVI   D/S   STP AT BHAGOT,HIMACHAL PRADESH,10.0,18.0,8.0,9.4,7.2,8.14,128.0,198.0,2.6251969852689276,5.892971727105102,0.7343646138807429,6.94,2.0,33.0,27.0,240.0,2022,3,Good,Neutral (6.5–8.5)
30085,RIVER         RAVI         AT MADHOPUR (PUNJAB),PUNJAB,18.0,24.0,9.1,10.1,8.1,8.3,156.0,200.0,1.2,1.2,0.32,0.52,45.0,23000.0,330.0,110000.0,2022,3,Good,Neutral (6.5–8.5)
30089,"RIVER         RAVI         AT LAKHANPUR, J & K",JAMMU & KASHMIR,17.0,26.0,9.0,10.4,8.2,8.9,168.0,351.0,2.0,2.0,0.32,0.32,78.0,170000.0,490.0,330000.0,2022,2,Moderate,Neutral (6.5–8.5)
1097,"RIVER RAVI AT U/S OF MADHOPUR HEADWORKS, GURDASPUR, PUNJAB",PUNJAB,12.0,37.0,7.3,10.3,7.6,8.2,149.0,230.0,1.1,1.2,0.4,0.8,17.0,33.0,94.0,170.0,2022,4,Excellent,Neutral (6.5–8.5)
1290,"RIVER               PARVATI BEFORE      CONF.      TO
RIVER        BEAS        AT BHUNTER",HIMACHAL PRADESH,3.0,17.0,7.2,9.2,7.42,8.3,51.0,94.0,2.6251969852689276,5.892971727105102,0.32,1.99,32.0,170.0,210.0,920.0,2022,3,Good,Neutral (6.5–8.5)
2605,RIVER     PARVATI     AT U/S MANIKARAN,HIMACHAL PRADESH,3.0,10.0,7.6,9.4,7.08,8.39,42.0,92.0,2.6251969852689276,5.892971727105102,0.32,1.64,21.0,43.0,58.0,170.0,2022,3,Good,Neutral (6.5–8.5)
2606,RIVER     PARVATI     AT D/S MANIKARAN,HIMACHAL PRADESH,3.0,12.0,7.6,9.2,6.85,8.36,38.0,103.0,2.6251969852689276,5.892971727105102,0.32,1.8,21.0,47.0,84.0,240.0,2022,3,Good,Neutral (6.5–8.5)
1551,RIVER       SIRSA       U/S SITOMAJRI NALLAH,HIMACHAL PRADESH,11.0,25.0,5.2,9.1,7.32,8.21,403.0,754.0,1.1,12.0,0.47,9.91,2.0,70.0,38.0,920.0,2022,3,Good,Neutral (6.5–8.5)
1552,RIVER       SIRSA       D/S NALAGARH BRIDGE,HIMACHAL PRADESH,11.0,29.0,5.0,7.8,7.28,8.42,459.0,1759.0,1.2,13.0,0.32,12.11,2.0,94.0,25.0,280.0,2022,3,Good,Neutral (6.5–8.5)
1868,RIVER     SIRSA         D/S NALAGARH  TOWN,HIMACHAL PRADESH,11.0,30.0,5.5,9.6,7.41,8.22,419.0,1300.0,1.2,4.0,0.64,8.9,2.0,49.0,27.0,540.0,2022,3,Good,Neutral (6.5–8.5)
4485,RIVER       SIRSA       U/S SANDHOLI NALLAH,HIMACHAL PRADESH,12.0,28.0,1.0,7.0,7.45,8.52,283.0,665.0,1.1,5.5,1.48,7.86,2.0,79.0,47.0,350.0,2022,1,Polluted,Neutral (6.5–8.5)
4487,RIVER       SIRSA       D/S HOUSING            BOARD NALLAH,HIMACHAL PRADESH,11.0,30.0,3.5,5.6,6.88,8.31,563.0,1466.0,2.0,8.8,1.42,18.03,2.0,110.0,21.0,350.0,2022,2,Moderate,Neutral (6.5–8.5)
4489,RIVER    SIRSA    AFTER CONF.        TO        RIVER RATTA,HIMACHAL PRADESH,10.0,30.0,4.5,7.0,7.21,8.28,642.0,1616.0,2.0,27.0,0.86,6.92,2.0,140.0,33.0,560.0,2022,2,Moderate,Neutral (6.5–8.5)
30012,"RIVER       SARSA       AT BADDI      ,      ,GHANOLI
VILLAGE) PUNJAB",PUNJAB,19.0,29.0,4.7,8.7,7.6,8.4,727.0,1522.0,5.0,14.0,3.75,6.5,4900.0,920000.0,11000.0,2400000.0,2022,1,Polluted,Neutral (6.5–8.5)
2616,RIVER BAIRA SIUL  D/S SURGANI,HIMACHAL PRADESH,8.0,19.0,8.6,9.2,6.72,8.14,130.0,301.0,2.6251969852689276,5.892971727105102,0.7343646138807429,4.21,2.0,26.0,21.0,1600.0,2022,3,Good,Neutral (6.5–8.5)
2607,"SUKETI                  KHAD
BEFORE   CONF.   WITH RIVER BEAS",HIMACHAL PRADESH,7.0,26.0,6.5,9.4,7.56,8.41,150.0,415.0,1.2,1.6,0.32,2.01,110.0,1600.0,540.0,1600.0,2022,3,Good,Neutral (6.5–8.5)
2608,RIVER  BINWA  AT  D/S PAPROLA/BAIJNATH,HIMACHAL PRADESH,15.0,22.0,7.5,9.3,6.9,8.24,64.0,269.0,2.6251969852689276,5.892971727105102,0.7343646138807429,4.52,2.0,46.0,22.0,280.0,2022,3,Good,Neutral (6.5–8.5)
2609,NEUGAL   KHAD      D/S THURAL,HIMACHAL PRADESH,10.0,26.0,8.5,9.3,7.11,8.02,109.0,271.0,2.6251969852689276,5.892971727105102,0.7343646138807429,5.81,2.0,33.0,14.0,280.0,2022,3,Good,Neutral (6.5–8.5)
2610,"RIVER   SPITI   BEFORE CONF.WITH         RIVER
SUTLEJ AT KHAB",HIMACHAL PRADESH,7.0,13.0,9.1,9.6,8.08,8.51,227.0,452.0,2.6251969852689276,5.892971727105102,0.32,0.61,4.0,17.0,6.8,1600.0,2022,2,Moderate,Neutral (6.5–8.5)
2612,RIVER      BASPA      U/S RESERVOIR         BASPA HEP AT KUPPA,HIMACHAL PRADESH,6.0,12.5,9.3,9.7,8.1,8.43,72.0,2423.0,2.6251969852689276,5.892971727105102,0.32,0.78,3.0,33.0,2.0,1600.0,2022,3,Good,Neutral (6.5–8.5)
2755,"RIVER          BANGANGA (BATHING           GHAT),
KATRA,",JAMMU & KASHMIR,11.0,25.0,5.0,7.2,7.85,8.75,326.0,420.0,1.3,2.2,0.7343646138807429,2.9544753347427766,3538.5852697095434,94402.99494284726,8970.337549488055,206671.80172366623,2022,2,Moderate,Neutral (6.5–8.5)
2756,RIVER  BANGANGA  (IN FRONT OF PONY SHED NEAR                      REASI BRIDGE)KATRA,JAMMU & KASHMIR,11.0,26.0,4.2,7.4,7.85,8.65,320.0,392.0,1.4,2.5,0.7343646138807429,2.9544753347427766,3538.5852697095434,94402.99494284726,8970.337549488055,206671.80172366623,2022,1,Polluted,Neutral (6.5–8.5)
2752,"RIVER  BASANTER  U/S (R.H.S)                 SAMBA
(BELOW                NH-1A BRIDGE),",JAMMU & KASHMIR,13.0,28.0,4.2,7.2,7.56,8.45,238.0,372.0,1.1,2.2,0.7343646138807429,2.9544753347427766,3538.5852697095434,94402.99494284726,8970.337549488055,206671.80172366623,2022,2,Moderate,Neutral (6.5–8.5)
2753,"RIVER           BASANTER
D/S(R.H.S.) SAMBA (AT CHAK MANGA GUJJAR",JAMMU & KASHMIR,13.0,29.0,4.3,6.8,7.35,8.2,256.0,372.0,1.2,2.6,0.7343646138807429,2.9544753347427766,3538.5852697095434,94402.99494284726,8970.337549488055,206671.80172366623,2022,2,Moderate,Neutral (6.5–8.5)
2748,RIVER     CHENAB     AT L.H.S.(BELOW   BRIDGE CHENAB),JAMMU & KASHMIR,12.0,16.0,7.0,7.7,7.26,8.2,124.0,162.0,1.1,1.1,0.7343646138807429,2.9544753347427766,3538.5852697095434,94402.99494284726,8970.337549488055,206671.80172366623,2022,3,Good,Neutral (6.5–8.5)
2749,"RIVER     CHENAB     AT BLIND                   CURVE SHAMSHAN GHAT  (1.5
KM U/S FROM SPOT)",JAMMU & KASHMIR,12.0,16.0,7.2,7.8,7.28,8.12,124.0,166.0,1.1,1.1,0.7343646138807429,2.9544753347427766,3538.5852697095434,94402.99494284726,8970.337549488055,206671.80172366623,2022,3,Good,Neutral (6.5–8.5)
2750,"RIVER     CHENAB     AT CHADRA   GAON   VIEW POINT(4 KM U/S FROM
SPOT)",JAMMU & KASHMIR,12.0,16.0,7.2,7.9,7.28,8.1,126.0,174.0,2.6251969852689276,5.892971727105102,0.7343646138807429,2.9544753347427766,3538.5852697095434,94402.99494284726,8970.337549488055,206671.80172366623,2022,2,Moderate,Neutral (6.5–8.5)
2751,"RIVER CHENAB AT JAL PATAN              MANDIR AFTER MEETING WITH MAIN        DRAIN        OF
AKHNOOR        CITY(1.5 KMD/S FROM SPOT)",JAMMU & KASHMIR,12.0,17.0,7.3,7.5,7.56,7.95,112.0,186.0,1.1,2.5,0.7343646138807429,2.9544753347427766,3538.5852697095434,94402.99494284726,8970.337549488055,206671.80172366623,2022,3,Good,Neutral (6.5–8.5)
2754,"RIVER                   DEVAK UDHAMPUR(NEAR SHIV                   MANDIR
D/S)L.H.S.",JAMMU & KASHMIR,14.0,28.0,4.2,6.3,7.82,8.2,284.0,526.0,2.3,3.3,0.7343646138807429,2.9544753347427766,3538.5852697095434,94402.99494284726,8970.337549488055,206671.80172366623,2022,1,Polluted,Neutral (6.5–8.5)
2757,RIVER       DEVAK       AT UTTERBEHNI,JAMMU & KASHMIR,16.0,26.0,7.0,7.3,7.97,8.1,380.0,420.0,2.6251969852689276,5.892971727105102,0.7343646138807429,2.9544753347427766,3538.5852697095434,94402.99494284726,8970.337549488055,206671.80172366623,2022,2,Moderate,Neutral (6.5–8.5)
2742,"RIVER        TAWI        AT SHETALI            LIFTING
POINT  NAGROTA(5KM U/S TAWI BRIDGE)",JAMMU & KASHMIR,16.0,29.0,6.8,7.8,7.2,7.95,140.0,324.0,2.6251969852689276,5.892971727105102,0.7343646138807429,2.9544753347427766,3538.5852697095434,94402.99494284726,8970.337549488055,206671.80172366623,2022,2,Moderate,Neutral (6.5–8.5)
2743,"RIVER TAWI AT BAGH- E-BAHU             LIFTING POINT(1 KM U/S TAWI
BRIDGE)",JAMMU & KASHMIR,14.0,29.0,6.5,7.8,7.4,8.24,142.0,334.0,1.1,1.1,0.7343646138807429,2.9544753347427766,3538.5852697095434,94402.99494284726,8970.337549488055,206671.80172366623,2022,3,Good,Neutral (6.5–8.5)
1412,"RIVER        TAWI        AT JAMMU     U/S,     (TAWI BRIDGE )",JAMMU & KASHMIR,14.0,32.0,4.4,5.9,7.45,8.2,296.0,548.0,2.6,5.8,0.7343646138807429,2.9544753347427766,3538.5852697095434,94402.99494284726,8970.337549488055,206671.80172366623,2022,1,Polluted,Neutral (6.5–8.5)
2744,RIVER   TAWI   BELOW TAWI BRIDGE,JAMMU & KASHMIR,14.0,30.0,5.0,7.1,7.71,8.85,146.0,380.0,1.3,3.1,0.7343646138807429,2.9544753347427766,3538.5852697095434,94402.99494284726,8970.337549488055,206671.80172366623,2022,1,Polluted,Neutral (6.5–8.5)
2745,RIVER                      TAWI BAGHWATI        NAGAR (2KM        D/S        TAWI BRIDGE,JAMMU & KASHMIR,14.0,30.0,3.5,6.0,7.55,8.85,145.0,376.0,5.2,8.3,0.7343646138807429,2.9544753347427766,3538.5852697095434,94402.99494284726,8970.337549488055,206671.80172366623,2022,0,Highly Polluted,Neutral (6.5–8.5)
2746,"RIVER        TAWI        AT BELICHARANA(4KM
D/S TAWI BRIDGE)",JAMMU & KASHMIR,15.0,31.0,6.6,7.2,7.65,8.57,138.0,362.0,1.3,1.3,0.7343646138807429,2.9544753347427766,3538.5852697095434,94402.99494284726,8970.337549488055,206671.80172366623,2022,2,Moderate,Neutral (6.5–8.5)
2747,"RIVER        TAWI        AT SURAJPUR CHATHA(10 KM          D/S          TAWI BRIDGE)BELOW BRIDGE                  NEAR
CHATHA                  MSW DUMPING SITE, J&K",JAMMU & KASHMIR,15.0,31.0,6.7,7.5,7.45,8.25,140.0,360.0,1.1,1.1,0.32,0.32,3538.5852697095434,94402.99494284726,8970.337549488055,206671.80172366623,2022,3,Good,Neutral (6.5–8.5)
4055,"RIVER  TAWI  AT  1  KM D/S        BELOW        STP
DISCHARGE  POINT  AT BHAGWATI NAGAR",JAMMU & KASHMIR,15.0,32.0,2.8,5.1,7.45,8.9,156.0,580.0,6.6,8.6,0.7343646138807429,2.9544753347427766,3538.5852697095434,94402.99494284726,8970.337549488055,206671.80172366623,2022,0,Highly Polluted,Neutral (6.5–8.5)
4056,"RIVER TAWI AT BALOL NALLAH,     NEAR    NIT COLLEGE,            MIRAN
SAHIB,                BEFORE MIXING",JAMMU & KASHMIR,14.0,32.0,4.3,6.1,7.56,8.5,280.0,460.0,3.1,4.5,0.7343646138807429,2.9544753347427766,3538.5852697095434,94402.99494284726,8970.337549488055,206671.80172366623,2022,1,Polluted,Neutral (6.5–8.5)
2758,"RIVER   UJH   AT   DAM SITE(L.H.S.), KATHUA",JAMMU & KASHMIR,22.0,24.0,7.4,7.8,7.8,8.1,204.0,232.0,2.6251969852689276,5.892971727105102,0.7343646138807429,2.9544753347427766,3538.5852697095434,94402.99494284726,8970.337549488055,206671.80172366623,2022,2,Moderate,Neutral (6.5–8.5)
4058,"RIVER       DEVAK       AT PURMANDAL,       NEAR TEMPLE",JAMMU & KASHMIR,16.0,26.0,5.2,6.6,8.1,8.2,392.0,545.0,1.1,1.4,0.7343646138807429,2.9544753347427766,3538.5852697095434,94402.99494284726,8970.337549488055,206671.80172366623,2022,3,Good,Neutral (6.5–8.5)
4062,"RIVER   DEVAK   2   KM D/S        FROM        SHIV MANDIR                       AT
UDHAMPUR,",JAMMU & KASHMIR,14.0,27.0,3.6,7.5,7.92,8.45,300.0,480.0,1.1,2.1,0.7343646138807429,2.9544753347427766,3538.5852697095434,94402.99494284726,8970.337549488055,206671.80172366623,2022,2,Moderate,Neutral (6.5–8.5)
4063,"RIVER  DEVAK  ABOUT 10 KM D/S FROM SHIV MANDIR,            BELOW
RAILWAY          BRIDGE, UDHAMPUR",JAMMU & KASHMIR,14.0,28.0,7.1,7.9,7.5,8.2,340.0,430.0,1.1,2.0,0.7343646138807429,2.9544753347427766,3538.5852697095434,94402.99494284726,8970.337549488055,206671.80172366623,2022,3,Good,Neutral (6.5–8.5)
4161,"RIVER      CONFLUENCE POINT OF SARSA NADI
WITH    WITH    SUTLEJ,",PUNJAB,9.0,27.0,6.6,10.5,7.6,8.5,268.0,540.0,1.2,1.2,1.4,2.3,130.0,780.0,580.0,1700.0,2022,3,Good,Neutral (6.5–8.5)
3856,RIVER       SWAN       U/S INDUSTRIAL         AREA GAGRET,HIMACHAL PRADESH,20.5,33.0,6.1,8.7,7.35,8.01,274.0,452.0,2.0,2.0,0.7343646138807429,5.67,2.0,26.0,33.0,350.0,2022,4,Excellent,Neutral (6.5–8.5)
3857,"RIVER       SWAN       D/S
INDUSTRIAL         AREA GAGRET",HIMACHAL PRADESH,20.5,33.0,6.0,8.6,7.4,8.03,288.0,464.0,2.0,3.0,0.36,8.11,2.0,58.0,34.0,540.0,2022,4,Excellent,Neutral (6.5–8.5)
3858,RIVER       SWAN       U/S SANTOSHGARH BRIDGE,HIMACHAL PRADESH,11.0,31.0,6.0,8.8,7.18,7.95,328.0,519.0,2.0,2.0,0.49,12.92,2.0,26.0,33.0,220.0,2022,4,Excellent,Neutral (6.5–8.5)
3859,"RIVER SWAN U/S UNA TOWN                           AT
GHALLUWAL BRIDGE",HIMACHAL PRADESH,21.0,32.0,6.4,8.6,7.23,8.06,295.0,498.0,2.0,2.0,0.5,9.12,2.0,38.0,34.0,920.0,2022,4,Excellent,Neutral (6.5–8.5)
4030,"RIVER  SWAN  BEFORE
CONF. OF GARNI KHAD AT CHURURU",HIMACHAL PRADESH,19.0,33.0,6.5,8.7,7.31,8.06,310.0,445.0,2.6251969852689276,5.892971727105102,0.32,5.39,2.0,37.0,25.0,280.0,2022,3,Good,Neutral (6.5–8.5)
4031,RIVER    SWAN   AFTER CONF. GARNI KHAD AT CHURURU,HIMACHAL PRADESH,19.0,33.0,6.6,8.8,7.4,8.09,324.0,460.0,2.0,2.0,0.7343646138807429,8.08,2.0,79.0,27.0,920.0,2022,4,Excellent,Neutral (6.5–8.5)
1869,RIVER       SWAN       D/S BELA                BATHARI (BHANGLA),HIMACHAL PRADESH,13.0,31.0,6.5,8.6,7.11,7.93,344.0,572.0,3.0,4.0,0.53,10.21,2.0,49.0,38.0,280.0,2022,3,Good,Neutral (6.5–8.5)
30011,"RIVER        SWAN        AT DHANGLA       VILLAGE, SANTOSHGARH (PUNJAB)",PUNJAB,19.0,33.0,8.6,9.4,7.9,8.4,367.0,532.0,1.2,3.0,0.32,1.81,120.0,13000.0,790.0,35000.0,2022,3,Good,Neutral (6.5–8.5)
