4320,RIVER     KUPLI     AT LOOSKI,MEGHALAYA,16.1,20.0,6.3,8.0,3.6,4.6,122.0,288.0,1.1,1.8,0.32,0.47,3538.5852697095434,94402.99494284726,6.0,33.0,2022,2,Moderate,Acidic (<6.5)
4321,RIVER     KUPLI     AT KHANDONG,MEGHALAYA,16.1,20.0,6.3,7.8,3.1,6.2,121.0,300.0,1.1,1.6,0.37,0.48,11.0,14.0,6.0,210.0,2022,3,Good,Acidic (<6.5)
4723,RIVER    TEESTA    AT JALPESH,WEST BENGAL,18.0,28.0,6.8,8.8,6.62,7.74,44.0,85.0,1.2,2.1,0.7343646138807429,2.24,200.0,9000.0,400.0,14000.0,2022,3,Good,Neutral (6.5–8.5)
4717,RIVER JALDHAKA AT DHUPGURI,WEST BENGAL,14.0,28.0,6.2,8.5,6.5,7.7,83.0,161.0,1.1,2.0,0.7343646138807429,1.46,600.0,9000.0,800.0,28000.0,2022,3,Good,Neutral (6.5–8.5)
4718,RIVER  SILTORSA  AT HASIMARA,WEST BENGAL,13.0,28.0,6.1,8.8,6.24,7.94,77.0,140.0,1.1,2.0,0.7343646138807429,1.83,1100.0,5000.0,2100.0,22000.0,2022,2,Moderate,Acidic (<6.5)
4728,RIVER    RAIDAK    AT ALIPURDUAR,WEST BENGAL,17.0,32.0,6.7,8.8,6.55,7.63,80.0,230.0,1.1,2.9,0.7343646138807429,1.6,2200.0,17000.0,5000.0,28000.0,2022,3,Good,Neutral (6.5–8.5)
4645,RIVER  CHELIKHOLA D/S   OF   BURIGAON BURIGAON RIVER,TRIPURA,19.5,31.5,5.1,6.8,7.1,7.74,131.0,191.0,1.3,2.2,1.0,2.3,32.0,84.0,150.0,350.0,2022,4,Excellent,Neutral (6.5–8.5)
4646,RIVER     GOLAGHATI U/S   OF   BURIGAON RIVER,TRIPURA,19.0,30.0,5.6,6.8,7.22,7.98,142.0,184.0,1.2,2.2,1.0,2.1,40.0,63.0,120.0,240.0,2022,4,Excellent,Neutral (6.5–8.5)
1428,"RIVER
KYRHUHKHLA KHLIEHRIAT",MEGHALAYA,12.0,21.0,6.6,7.4,3.1,4.8,132.0,610.0,1.6,2.4,0.32,0.93,3538.5852697095434,94402.99494284726,17.0,33.0,2022,2,Moderate,Acidic (<6.5)
1631,RIVER          MYNTDU JOWAI,MEGHALAYA,9.0,21.0,6.4,7.7,6.6,7.2,41.0,68.0,1.5,2.2,0.32,0.63,150.0,630.0,790.0,2800.0,2022,3,Good,Neutral (6.5–8.5)
1633,RIVER          SIMSANG WILLIAMNAGAR,MEGHALAYA,19.0,22.0,6.9,7.9,6.9,7.3,62.0,75.0,1.2,1.5,0.42,0.57,120.0,230.0,430.0,700.0,2022,4,Excellent,Neutral (6.5–8.5)
3353,RIVER              UMIAM MAWPHLANG        AT NONGKREM,MEGHALAYA,6.0,19.0,6.8,8.0,6.6,7.2,52.0,90.0,1.2,2.0,0.75,1.47,80.0,140.0,630.0,920.0,2022,4,Excellent,Neutral (6.5–8.5)
3354,RIVER              UMIAM MAWPHLANG        AT UMTYNGNGAR,MEGHALAYA,12.0,25.0,6.5,8.0,6.7,7.1,39.0,58.0,1.3,2.2,0.39,0.63,21.0,46.0,540.0,1200.0,2022,4,Excellent,Neutral (6.5–8.5)
3355,RIVER              UMIAM MAWPHLANG        AT MAWPHLANG,MEGHALAYA,13.0,21.0,7.0,8.0,6.6,7.2,37.0,41.0,1.2,2.0,0.5,1.82,11.0,48.0,430.0,630.0,2022,4,Excellent,Neutral (6.5–8.5)
3356,"RIVER              UMIAM MAWPHLANG        AT
SHELLA",MEGHALAYA,18.0,23.0,7.7,8.5,7.4,7.8,97.0,200.0,1.1,1.2,0.47,0.67,2.0,11.0,33.0,84.0,2022,4,Excellent,Neutral (6.5–8.5)
3357,"RIVER  UMNGOT  AT SMIT,",MEGHALAYA,5.0,20.0,6.7,7.9,6.6,7.6,37.0,52.0,1.3,2.0,0.47,0.69,11.0,30.0,220.0,540.0,2022,4,Excellent,Neutral (6.5–8.5)
3358,"RIVER  UMNGOT  AT
DAWKI",MEGHALAYA,14.0,27.0,7.6,8.3,6.9,7.3,40.0,58.0,1.1,1.4,0.32,0.48,3538.5852697095434,94402.99494284726,33.0,49.0,2022,3,Good,Neutral (6.5–8.5)
3375,RIVER    LUNAR    AT MYNDIHATI (TRIBUTARY          OF LUKHA),MEGHALAYA,15.0,22.0,6.5,7.5,2.8,7.1,37.0,1265.0,1.1,2.5,0.32,0.99,3538.5852697095434,94402.99494284726,31.0,31.0,2022,2,Moderate,Acidic (<6.5)
3376,RIVER    LUKHA    AT SONAPUR,MEGHALAYA,15.0,21.0,7.0,8.0,5.9,7.7,120.0,428.0,1.2,1.6,0.39,0.62,6.0,21.0,70.0,220.0,2022,3,Good,Acidic (<6.5)
3379,RIVER  MYNTDU  AT LESHKA,MEGHALAYA,14.0,21.0,6.8,7.9,4.6,6.7,40.0,75.0,1.2,1.7,0.32,0.52,14.0,38.0,150.0,240.0,2022,3,Good,Acidic (<6.5)
3383,RIVER      BUGI      AT MIBONPARA,MEGHALAYA,18.0,21.0,7.0,7.6,6.9,7.5,74.0,119.0,1.1,1.6,0.38,0.53,41.0,71.0,430.0,540.0,2022,4,Excellent,Neutral (6.5–8.5)
3384,RIVER      BUGI      AT DALU,MEGHALAYA,18.0,21.0,6.8,7.5,7.0,7.6,70.0,125.0,1.3,1.7,0.41,0.53,49.0,120.0,460.0,790.0,2022,4,Excellent,Neutral (6.5–8.5)
3760,"RIVER  BAROI  NEAR BRIDGE   AT   NH-52, BISWANATH
DISTRICT",ASSAM,20.0,28.0,5.4,6.1,6.8,7.8,122.0,170.0,2.0,2.8,0.7,1.2,300.0,720.0,910.0,1400.0,2022,3,Good,Neutral (6.5–8.5)
3765,"RIVER      BEGA     MG ROAD, MANGALDOI",ASSAM,22.0,30.0,5.0,6.0,7.0,7.8,94.0,149.0,3.0,3.8,0.9,1.3,360.0,1100.0,1100.0,2100.0,2022,2,Moderate,Neutral (6.5–8.5)
3767,"RIVER    NUWA    NOI NEAR  BRIDGE  OVER BOINAOJA         PARA, MANGALDOI",ASSAM,20.0,30.0,5.4,6.3,7.3,7.8,90.0,132.0,2.4,2.6,0.7,1.2,300.0,730.0,910.0,1300.0,2022,3,Good,Neutral (6.5–8.5)
3773,"RIVER  TOWKAK  AT
SONARI",ASSAM,16.0,30.0,6.2,7.3,6.7,7.2,102.0,131.0,2.1,2.7,0.8,1.2,360.0,1500.0,730.0,2100.0,2022,3,Good,Neutral (6.5–8.5)
3774,RIVER    SUFFRY    AT MAIBELLA,ASSAM,15.0,30.0,6.5,7.4,6.8,7.8,208.0,341.0,2.2,2.6,0.8,1.2,300.0,360.0,360.0,910.0,2022,4,Excellent,Neutral (6.5–8.5)
3780,"RIVER  SESSA  NEAR SESSA   TINIALI,   NH
BRIDGE, DIBRUGARH",ASSAM,22.0,24.0,4.0,9.7,6.8,7.6,152.0,213.0,2.1,2.6,0.7,2.0,300.0,730.0,910.0,2000.0,2022,2,Moderate,Neutral (6.5–8.5)
3788,"RIVER           JIADHAL KUMOTIYA      RIVER NEAR            JIADHAL
BRIDGE, DHEMAJI",ASSAM,22.0,25.0,6.8,8.9,7.2,8.0,197.0,240.0,2.3,2.5,0.9,1.9,300.0,730.0,600.0,1200.0,2022,3,Good,Neutral (6.5–8.5)
3796,"RIVER   KUJI   (NEAR NEW  BOGAGIGAON) NEAR              WATER INTAKE  POINT  FOR
NF RAILWAY",ASSAM,22.0,31.0,5.3,5.5,7.0,7.7,99.0,218.0,2.2,2.8,0.7,1.4,300.0,720.0,720.0,1400.0,2022,3,Good,Neutral (6.5–8.5)
3799,RIVER    KILLING    IN MORIGAON DISTRICT,ASSAM,19.0,29.0,4.1,9.3,6.9,7.8,80.0,123.0,2.0,2.8,0.7,2.2,360.0,910.0,1100.0,2100.0,2022,2,Moderate,Neutral (6.5–8.5)
3803,"RIVER MADHURA AT
MADHURAGHAT, CACHAR",ASSAM,20.0,24.0,5.1,5.6,7.1,7.5,96.0,116.0,2.1,2.6,0.7,1.1,300.0,730.0,910.0,1600.0,2022,3,Good,Neutral (6.5–8.5)
5135,"RIVER   AIE       NEAR RAKHALDUBI   DIST., BONGAIGAON,
ASSAM",ASSAM,21.0,33.0,5.1,5.6,7.0,7.7,168.0,202.0,2.1,2.7,0.8,1.4,300.0,730.0,720.0,1500.0,2022,3,Good,Neutral (6.5–8.5)
5138,"RIVER,  TUNIA     U/S BRPL,    DHALIGAON, DIST. CHIRANG",ASSAM,23.0,32.0,5.2,5.5,7.0,7.6,158.0,171.0,2.3,2.7,0.8,2.3,300.0,730.0,610.0,1500.0,2022,3,Good,Neutral (6.5–8.5)
5139,"RIVER   JAMUNA   AT DOBOKA            NEAR
BRIDGE, DIST. HOJAI",ASSAM,20.0,33.0,4.2,8.5,6.9,7.4,75.0,204.0,2.2,2.7,0.8,1.6,360.0,910.0,910.0,2000.0,2022,2,Moderate,Neutral (6.5–8.5)
5140,"RIVER   BONDANJAN, SLUICE               GATE, BIRKUCHI  NARENGI TINIALI, KHARGHULI, NO. 2",ASSAM,21.0,34.0,4.0,4.2,6.8,7.5,182.0,230.0,2.1,2.6,0.8,1.9,1100.0,2000.0,2000.0,3500.0,2022,2,Moderate,Neutral (6.5–8.5)
5141,"RIVER        BASISTHA BASISTHA
CHARIALI,      NUTAN BAZAAR,",ASSAM,20.0,31.0,4.0,7.5,6.8,7.2,158.0,228.0,2.1,2.8,0.8,1.4,730.0,1600.0,1500.0,3500.0,2022,2,Moderate,Neutral (6.5–8.5)
5142,"RIVER            PAMOHI GACHUK,      PAMOHI
ROAD, GUWAHATI",ASSAM,18.0,31.0,1.2,6.8,6.8,7.5,192.0,286.0,2.4,4.1,1.0,2.4,930.0,2100.0,1900.0,3500.0,2022,1,Polluted,Neutral (6.5–8.5)
5144,RIVER       KALANADI NEAR      BAMUNJULI BRIDGE     CROSSING AT          MANGALDOI BHUTIACHANG,ASSAM,22.0,22.0,8.4,8.4,7.0,7.0,202.0,202.0,1.9,1.9,0.8,0.8,300.0,300.0,730.0,730.0,2022,4,Excellent,Neutral (6.5–8.5)
5281,RIVER  RANGPO  U/S DAM SITE,SIKKIM,9.0,20.0,8.4,8.9,6.6,8.0,159.0,205.0,1.1,2.4,2.2,4.9,55.0,100.0,70.0,172.0,2022,4,Excellent,Neutral (6.5–8.5)
5282,RIVER  RANGPO  D/S DAM SITE,SIKKIM,10.0,20.0,1.9,9.0,6.6,7.2,160.0,188.0,1.4,22.0,2.1,4.9,83.0,105.0,125.0,179.0,2022,2,Moderate,Neutral (6.5–8.5)
5283,RIVER   RONGLI   U/S DAM SITE,SIKKIM,11.0,22.0,7.7,9.4,6.8,7.5,120.0,170.0,1.4,2.3,2.1,4.5,90.0,103.0,130.0,230.0,2022,4,Excellent,Neutral (6.5–8.5)
5284,RIVER   RONGLI   D/S DAM SITE,SIKKIM,13.0,22.0,8.4,9.7,6.5,7.4,95.0,134.0,1.6,2.3,2.4,5.1,79.0,101.0,110.0,180.0,2022,4,Excellent,Neutral (6.5–8.5)
5285,RIVER   RANGPO   AT POWER  HOUSE  D/S OF GATI INFRA PVT. LTD.,SIKKIM,12.0,20.0,8.2,10.0,6.5,7.3,32.0,180.0,1.7,8.6,2.0,4.9,65.0,91.0,125.0,175.0,2022,3,Good,Neutral (6.5–8.5)
5286,"RIVER   RANGPO   AT U/S OF RORATHANG
BAZAR            (ABOVE SWISS GARNIER)",SIKKIM,12.0,22.0,7.1,9.0,6.4,7.2,34.0,150.0,1.5,2.4,2.3,4.8,100.0,120.0,153.0,250.0,2022,3,Good,Acidic (<6.5)
5287,"RIVER   RANGPO   AT D/S OF RORATHANG
BRIDGE",SIKKIM,14.0,21.0,8.1,9.9,6.5,7.4,35.0,143.0,1.5,2.5,2.0,5.0,90.0,103.0,153.0,165.0,2022,4,Excellent,Neutral (6.5–8.5)
5288,"RIVER   RANGPO   AT
D/S     OF     PHARMA PLANT KUMREK",SIKKIM,14.0,22.0,7.0,9.2,6.5,7.6,37.0,179.0,2.2,2.6,2.1,4.7,90.0,125.0,142.0,160.0,2022,4,Excellent,Neutral (6.5–8.5)
5289,"RIVER   RANGPO   AT D/S      OF      POWER HOUSE  OF  MADHYA
BHARAT",SIKKIM,15.0,23.0,7.4,9.3,6.4,7.3,40.0,145.0,2.1,2.7,2.1,4.9,85.0,104.0,125.0,250.0,2022,3,Good,Acidic (<6.5)
4219,RIVER       DEO       AT SANTIPUR,TRIPURA,19.0,30.5,5.4,6.8,6.97,7.74,144.0,192.0,1.1,1.9,0.8,1.8,25.0,63.0,94.0,220.0,2022,4,Excellent,Neutral (6.5–8.5)
4220,RIVER       DEO       AT SUBASH NAGAR,TRIPURA,19.0,31.0,5.3,6.7,6.89,7.45,127.0,184.0,1.1,1.7,0.8,1.9,25.0,58.0,94.0,210.0,2022,4,Excellent,Neutral (6.5–8.5)
4655,RIVER       DEO       AT KANCHANPUR,TRIPURA,19.0,31.0,5.2,6.1,7.08,7.84,141.0,199.0,1.2,2.4,1.1,2.6,30.0,63.0,120.0,220.0,2022,4,Excellent,Neutral (6.5–8.5)
4640,"RIVER                       AT
BORDOWALI, HAORA",TRIPURA,19.5,31.5,5.7,6.9,7.18,7.85,154.0,247.0,1.6,2.7,1.7,3.1,58.0,79.0,210.0,350.0,2022,4,Excellent,Neutral (6.5–8.5)
4654,"RIVER       JURI       AT
CHAMTALI",TRIPURA,19.0,30.5,5.3,6.9,7.05,7.69,141.0,191.0,1.1,1.9,0.8,2.0,25.0,58.0,110.0,240.0,2022,4,Excellent,Neutral (6.5–8.5)
4649,RIVER     MANU     AT MANUBAZAR,TRIPURA,19.0,30.5,5.3,6.6,7.01,7.69,129.0,191.0,1.2,1.9,1.1,2.4,33.0,63.0,120.0,280.0,2022,4,Excellent,Neutral (6.5–8.5)
4650,RIVER     MANU     AT CHAILENGTA,TRIPURA,18.5,29.0,5.1,6.4,6.78,7.57,131.0,194.0,1.1,1.9,0.7,2.5,22.0,58.0,110.0,240.0,2022,4,Excellent,Neutral (6.5–8.5)
1232,"RIVER      MAHI      (D/S) CONF   WITH   R.   CHAP (UNDER        SAGWARA-
SARHI RD. BDG.)",RAJASTHAN,19.0,31.0,5.3,6.4,6.91,8.55,273.0,621.0,1.3,2.4,1.27,2.63,55.0,170.0,130.0,240.0,2022,3,Good,Neutral (6.5–8.5)
30061,"RIVER        MAHI        AT GAMMON           BRIDGE NEAR PADLA CHOWKI, BANSWARA     (MP      &
RJASTHAN)",RAJASTHAN,25.0,32.0,7.2,8.5,6.7,8.24,172.0,328.0,2.3,6.0,0.7343646138807429,0.74,18.0,18.0,70.0,250.0,2022,3,Good,Neutral (6.5–8.5)
4,RIVER        MAHI        AT SEVALIA,GUJARAT,24.0,30.0,3.8,8.8,8.05,8.5,443.0,610.0,2.6251969852689276,5.892971727105102,0.32,1.55,2.0,6.8,11.0,63.0,2022,2,Moderate,Neutral (6.5–8.5)
5,RIVER MAHI AT VASAD,GUJARAT,22.0,30.0,6.5,8.7,7.85,8.49,356.0,569.0,2.6251969852689276,5.892971727105102,0.7343646138807429,1.74,2.0,17.0,17.0,70.0,2022,3,Good,Neutral (6.5–8.5)
1229,"RIVER     MAHI     NEAR RAJASTHAN     BORDER AT KADANA DAM,",GUJARAT,23.0,29.0,5.3,8.3,7.69,8.45,356.0,608.0,2.6251969852689276,5.892971727105102,0.32,1.86,2.0,4.0,11.0,21.0,2022,3,Good,Neutral (6.5–8.5)
1230,"RIVER    MAHI    AFTER CONF.  WITH  ANAS  AT PARDI (BANASWADA),",GUJARAT,23.0,29.0,6.6,8.7,7.81,8.47,328.0,608.0,2.6251969852689276,5.892971727105102,0.32,1.85,2.0,4.0,21.0,33.0,2022,3,Good,Neutral (6.5–8.5)
1231,"RIVER        MAHI        AT VIRPUR,",GUJARAT,23.0,29.0,6.6,8.5,7.57,8.51,340.0,604.0,2.6251969852689276,5.892971727105102,0.32,1.86,2.0,7.0,12.0,33.0,2022,2,Moderate,Neutral (6.5–8.5)
1863,"RIVER        MAHI        AT
UMETA BRIDGE",GUJARAT,23.0,30.0,6.9,8.5,8.29,8.88,350.0,592.0,2.6251969852689276,5.892971727105102,0.7343646138807429,1.03,2.0,17.0,17.0,63.0,2022,2,Moderate,Neutral (6.5–8.5)
1864,RIVER        MAHI        AT MUJPUR,GUJARAT,25.0,30.0,6.6,8.6,7.89,8.82,381.0,24390.0,2.6251969852689276,5.892971727105102,0.32,1.9,4.0,63.0,63.0,170.0,2022,2,Moderate,Neutral (6.5–8.5)
3206,"RIVER        MAHI        AT SHERKHI
BRIDGESINDHROT BRIDGE-VADODARA",GUJARAT,25.0,30.0,7.0,8.5,7.76,8.78,399.0,1006.0,2.6251969852689276,5.892971727105102,0.32,2.01,4.0,21.0,27.0,110.0,2022,2,Moderate,Neutral (6.5–8.5)
4415,RIVER        MAHI        AT DODKAVILLAGE             : PRATHAMPURA,GUJARAT,25.0,30.0,7.8,8.8,8.06,8.84,375.0,828.0,2.6251969852689276,5.892971727105102,0.34,1.89,2.0,11.0,14.0,70.0,2022,2,Moderate,Neutral (6.5–8.5)
30050,"RIVER    MAHI    ABOUT
500   METERS   D/S   OF KADANA    DAM    NEAR BRIDGE, PANCHMAHAL, GUJARAT  (RAJASTHAN
AND GUJARAT)",GUJARAT,25.5,25.5,7.0,7.0,8.04,8.04,446.0,446.0,3.9,3.9,1.2,1.2,110.0,110.0,330.0,330.0,2022,3,Good,Neutral (6.5–8.5)
1233,"RIVER        MAHI        AT BADNAWAR, M.P.",MADHYA PRADESH,20.0,22.0,7.0,8.3,7.8,8.33,340.0,416.0,1.1,1.4,0.77,0.98,3538.5852697095434,94402.99494284726,36.0,49.0,2022,3,Good,Neutral (6.5–8.5)
3318,"RIVER        MAHI        AT RANISINGH     VILLAGE,
RATLAM, UJJAIN",MADHYA PRADESH,26.0,27.0,7.0,7.6,7.54,7.92,264.0,649.0,1.6,2.1,0.32,0.82,2.0,4.0,48.0,49.0,2022,4,Excellent,Neutral (6.5–8.5)
4608,"RIVER   MAHI   FOREST GUEST                   HOUSE
RAJAPUR             MATAJI SHIVGARH RATLAM.",MADHYA PRADESH,26.0,29.0,7.2,7.6,7.4,7.98,216.0,663.0,1.8,2.0,0.32,0.94,2.0,2.0,46.0,49.0,2022,4,Excellent,Neutral (6.5–8.5)
30058,RIVER        MAHI        AT VILLAGE BAJNA (MP & RJASTHAN),MADHYA PRADESH,24.0,28.0,8.1,9.3,7.2,8.42,179.0,387.0,2.5,5.6,0.7343646138807429,0.5,23.0,23.0,130.0,1600.0,2022,3,Good,Neutral (6.5–8.5)
3848,"RIVER     ANAS     RIVER NEAR    ROAD    BRIDGE
JHABUA",MADHYA PRADESH,20.0,22.0,5.8,8.4,7.9,8.46,244.0,526.0,2.6251969852689276,1.4,0.5,1.23,3538.5852697095434,94402.99494284726,40.0,49.0,2022,3,Good,Neutral (6.5–8.5)
1228,"RIVER        ANAS        AT DAHOD, (KUSHALGARH),   DIST. PANCHMAHAL",GUJARAT,23.0,29.0,6.6,8.5,8.12,8.49,316.0,724.0,2.6251969852689276,5.892971727105102,0.37,2.63,2.0,6.8,12.0,47.0,2022,3,Good,Neutral (6.5–8.5)
2104,RIVER       MALEI       AT JAORA,MADHYA PRADESH,23.0,26.0,7.1,7.8,7.46,7.96,302.0,712.0,1.8,2.0,0.73,1.21,2.0,4.0,38.0,49.0,2022,4,Excellent,Neutral (6.5–8.5)
1227,"RIVER      PANAM      AT LUNAWADA,",GUJARAT,23.0,29.0,5.5,8.2,7.41,8.49,395.0,623.0,2.6251969852689276,5.892971727105102,0.32,0.65,2.0,4.0,12.0,33.0,2022,3,Good,Neutral (6.5–8.5)
4805,"BHANWAR          SEMLA DAM   NEAR   VILLAGE- DHOPAL,PRATAPGARH",RAJASTHAN,16.0,28.0,5.5,6.6,7.0,8.53,456.0,2465.0,1.2,2.9,2.12,4.72,80.0,150.0,170.0,350.0,2022,3,Good,Neutral (6.5–8.5)
2102,"RIVER      SHIVNA      AT
RAMGHAT, MANDSAUR",MADHYA PRADESH,26.0,28.0,7.2,7.6,7.64,7.88,188.0,695.0,1.8,2.0,0.61,1.22,2.0,2.0,43.0,49.0,2022,4,Excellent,Neutral (6.5–8.5)
1223,"RIVER    SABARMATI AFTER  CONF.  WITH MESHWA                 AT
VAUTHA           (NEAR DHOKLA),",GUJARAT,23.0,36.0,0.7,5.2,7.3,8.17,638.0,2788.0,5.9,77.0,0.33,0.82,1600.0,1600.0,1600.0,1600.0,2022,1,Polluted,Neutral (6.5–8.5)
1409,"RIVER    SABARMATI AT                RAILWAY
BRIDGE AHMEDABAD,",GUJARAT,17.89136416861827,30.0,1.7,6.5,7.0,8.36,347.0,1033.0,1.1,28.0,0.32,0.95,12.0,220.0,70.0,920.0,2022,2,Moderate,Neutral (6.5–8.5)
1866,"RIVER    SABARMATI AT                HANSAOL BRIDGE,",GUJARAT,22.0,30.0,5.5,8.2,7.15,8.2,283.0,452.0,1.4,1.8,0.32,0.8,4.0,21.0,33.0,94.0,2022,4,Excellent,Neutral (6.5–8.5)
2,"RIVER    SABARMATI AT  AHMEDABAD  AT
V.N. BRIDGE",GUJARAT,17.89136416861827,31.0,0.3,6.0,6.56,7.8,408.0,2084.0,1.1,96.0,0.32,0.92,12.0,1600.0,70.0,1600.0,2022,1,Polluted,Neutral (6.5–8.5)
1407,"RIVER    SABARMATI AT  GANDHI  NAGAR CHILODA      BRIDGE, LEKAWADA,",GUJARAT,28.0,31.0,5.9,6.5,7.64,8.25,400.0,480.0,2.3,2.3,0.41,0.48,12.0,70.0,70.0,350.0,2022,4,Excellent,Neutral (6.5–8.5)
1408,"RIVER    SABARMATI AT     VILL.     MIROLI TALUKA      DASCROI, AHMEDABAD,",GUJARAT,23.0,30.0,0.8,6.5,7.2,7.96,784.0,2702.0,1.3,66.0,0.34,0.6,920.0,1600.0,1600.0,1600.0,2022,1,Polluted,Neutral (6.5–8.5)
1,RIVER    SABARMATI AT DHAROI DAM,GUJARAT,25.0,30.0,5.7,8.7,7.45,7.77,422.0,558.0,2.6251969852689276,5.892971727105102,0.39,0.62,17.0,17.0,6.0,110.0,2022,3,Good,Neutral (6.5–8.5)
2075,"RIVER    SABARMATI AT    DHAROI    DAM, DIST. MEHSANA.RIVER SABARMATI           TA DHAROI  DAM,  TAL  :
SATALASANA, DIST : MEHSANA",GUJARAT,24.0,34.0,5.4,7.5,7.58,8.29,360.0,1237.0,2.6251969852689276,5.892971727105102,0.32,0.76,4.0,12.0,4.0,26.0,2022,3,Good,Neutral (6.5–8.5)
10014,"RIVER    SABARMATI AT         AHMEDABAD U/SHANSOL,
AHMEDABAD",GUJARAT,22.0,30.0,5.5,8.2,7.15,8.2,283.0,452.0,1.4,1.8,0.32,0.81,4.0,21.0,33.0,94.0,2022,4,Excellent,Neutral (6.5–8.5)
30042,"RIVER  SABARMAATI AT  KHEROJ  BRIDGE, SABARKANTHA, AMBAJI     HIGHWAY, KHEROJ,      GUJARAT
(RAJASTHAN      AND GUJARAT)",GUJARAT,22.0,22.0,10.9,10.9,8.53,8.53,593.0,593.0,1.2,1.2,0.38,0.38,220.0,220.0,330.0,330.0,2022,3,Good,Alkaline (>8.5)
3321,"RIVER  NARMADA  AT
AMARKANTAK  FROM ORIGIN POINT,",MADHYA PRADESH,21.0,30.0,6.9,8.5,7.73,8.5,231.0,625.0,1.1,2.8,0.32,0.5,3538.5852697095434,94402.99494284726,27.0,50.0,2022,3,Good,Neutral (6.5–8.5)
1242,"RIVER          NARMADA NEAR  ORIGIN  POINT
AT AMARKANTAK",MADHYA PRADESH,22.8,30.5,5.7,7.0,6.67,8.21,196.0,2213.0,1.1,2.6,0.32,0.36,3538.5852697095434,94402.99494284726,3.7,63.0,2022,3,Good,Neutral (6.5–8.5)
4578,RIVER  NARMADA  AT PUSKAR                  DAM AMARKANTAK,MADHYA PRADESH,22.7,30.2,7.1,8.1,6.79,8.12,212.0,312.0,1.6,2.6,0.32,0.5,3538.5852697095434,94402.99494284726,47.0,94.0,2022,3,Good,Neutral (6.5–8.5)
1241,RIVER  NARMADA  AT MANDLA NEAR ROAD BRIDGE. M.P.,MADHYA PRADESH,18.2,23.7,7.2,8.0,7.31,8.2,187.0,348.0,1.2,1.8,0.21,1.0,2.0,6.0,26.0,70.0,2022,4,Excellent,Neutral (6.5–8.5)
1240,"RIVER  NARMADA  AT BARMANGHAT, NARSINGHPUR M.P.",MADHYA PRADESH,18.2,25.3,7.5,8.8,7.3,8.49,209.0,310.0,1.2,1.8,0.28,1.1,2.0,2.0,17.0,170.0,2022,4,Excellent,Neutral (6.5–8.5)
2106,RIVER  NARMADA  AT NEMAWAR,MADHYA PRADESH,22.0,26.0,0.8,7.6,7.3,8.32,214.0,892.0,1.4,2.0,0.55,2.64,2.0,6.0,2.0,48.0,2022,3,Good,Neutral (6.5–8.5)
4594,RIVER  NARMADA  AT BEFOR    CONFLU.    OF RIVER  JAMNER  VILL. NEMAWAR,MADHYA PRADESH,22.0,26.0,7.2,7.8,7.2,7.9,244.0,416.0,1.6,2.0,0.5,1.56,2.0,6.0,46.0,48.0,2022,4,Excellent,Neutral (6.5–8.5)
4595,RIVER NARMADA 500 M.D/S      NEAR      JAIN MANDER        VILLAGE NEMAWAR,MADHYA PRADESH,22.0,26.0,7.0,7.7,7.3,7.88,239.0,440.0,1.8,2.0,0.32,1.02,2.0,4.0,46.0,49.0,2022,4,Excellent,Neutral (6.5–8.5)
45,RIVER  NARMADA  AT MANDLESHWAR,MADHYA PRADESH,20.0,21.5,6.9,8.3,7.7,8.45,230.0,326.0,1.1,1.2,0.54,1.01,3538.5852697095434,94402.99494284726,33.0,47.0,2022,3,Good,Neutral (6.5–8.5)
1239,"RIVER  NARMADA  AT BADWANI, M.P.",MADHYA PRADESH,20.0,22.0,5.8,8.4,7.3,8.5,272.0,3362.0,1.1,1.3,0.47,10.4,3538.5852697095434,94402.99494284726,34.0,49.0,2022,3,Good,Neutral (6.5–8.5)
1431,"RIVER  NARMADA  AT MAHESHWAR, M. P.",MADHYA PRADESH,20.0,21.6,6.9,8.3,7.8,8.5,219.0,517.0,1.1,1.2,0.43,1.12,3538.5852697095434,94402.99494284726,40.0,49.0,2022,3,Good,Neutral (6.5–8.5)
1234,"RIVER          NARMADA
NEAR           SHAHGANJ
GUEST                HOUSE DISTRICT SEHORE",MADHYA PRADESH,19.0,31.0,5.2,9.0,7.44,8.22,175.0,2146.0,1.1,1.6,0.94,9.41,4.0,58.0,94.0,430.0,2022,4,Excellent,Neutral (6.5–8.5)
2112,"RIVER          NARMADA NEAR         MORTAKKA BRIDGE, BADWAH",MADHYA PRADESH,20.0,22.0,6.4,8.4,7.66,8.5,272.0,396.0,1.1,1.2,0.62,1.12,3538.5852697095434,94402.99494284726,3.0,46.0,2022,3,Good,Neutral (6.5–8.5)
44,"RIVER  NARMADA  AT
SETHANIGHAT",MADHYA PRADESH,18.0,29.0,7.2,8.6,7.43,8.48,250.0,318.0,1.1,2.0,0.88,2.34,4.5,170.0,41.0,430.0,2022,4,Excellent,Neutral (6.5–8.5)
1235,"RIVER  NARMADA  AT HOSHANGABAD    100 METER   D/   S   AFTER CONFLUENCE OF SPM
NALLA M.P.",MADHYA PRADESH,16.0,29.0,7.4,8.5,7.14,8.26,257.0,365.0,1.4,1.9,1.04,2.82,12.0,150.0,280.0,430.0,2022,4,Excellent,Neutral (6.5–8.5)
2113,"RIVER          NARMADA NEAR   PUNASA   DAM, PUNASA",MADHYA PRADESH,19.0,21.5,7.1,8.4,8.31,8.6,218.0,329.0,1.1,1.1,0.6,1.02,3538.5852697095434,94402.99494284726,33.0,47.0,2022,2,Moderate,Neutral (6.5–8.5)
1430,"RIVER  NARMADA  AT D/S                               OF
OMKARESHWAR M.P.",MADHYA PRADESH,8.2,21.5,1.1,8.2,7.68,8.5,224.0,349.0,1.1,1.2,0.64,1.02,3538.5852697095434,94402.99494284726,38.0,49.0,2022,2,Moderate,Neutral (6.5–8.5)
3322,"RIVER  NARMADA  AT MANDLA,             NEAR SHAMSHANGHAT,
JABALPUR",MADHYA PRADESH,18.2,23.5,7.4,8.3,7.21,8.6,169.0,321.0,1.1,1.6,0.7343646138807429,1.0,2.0,6.0,25.0,79.0,2022,3,Good,Neutral (6.5–8.5)
2099,"RIVER  NARMADA  AT LALPUR, JABALPUR",MADHYA PRADESH,18.1,23.8,7.3,8.0,7.18,8.31,248.0,342.0,1.2,1.9,0.24,1.1,2.0,4.0,17.0,94.0,2022,4,Excellent,Neutral (6.5–8.5)
3323,"RIVER  NARMADA  AT
TILWARAGHAT,",MADHYA PRADESH,18.2,23.9,7.1,8.0,7.3,8.21,236.0,351.0,1.2,1.8,0.21,1.0,4.0,6.0,38.0,94.0,2022,4,Excellent,Neutral (6.5–8.5)
3324,"RIVER  NARMADA  AT PANCHWATIGHAT, BEFORE            MIXING WITH  BAWANGANGA
RIVER, JABALPUR",MADHYA PRADESH,18.1,25.2,7.1,8.3,7.21,8.28,172.0,370.0,1.1,1.9,0.27,1.6,4.0,10.0,17.0,170.0,2022,4,Excellent,Neutral (6.5–8.5)
3325,"RIVER  NARMADA  AT SARSWATIGHAT, AFTER  MIXING  WITH BAWANGANGA RIVER, JABALPUR",MADHYA PRADESH,18.1,25.2,7.5,8.1,7.28,8.34,217.0,316.0,1.2,1.9,0.26,0.8,4.0,10.0,17.0,210.0,2022,4,Excellent,Neutral (6.5–8.5)
2118,RIVER          NARMADA RIVER    AT    D/S    OF KAPILDHARA,MADHYA PRADESH,22.8,30.0,6.8,7.7,6.72,8.1,221.0,318.0,1.1,2.3,0.32,0.54,4.0,4.0,37.0,110.0,2022,4,Excellent,Neutral (6.5–8.5)
2123,RIVER  NARMADA  AT KORIGHAT HOSHANGABAD,MADHYA PRADESH,16.0,29.0,7.0,8.4,7.26,8.26,226.0,301.0,1.2,1.8,1.22,2.42,12.0,33.0,94.0,280.0,2022,4,Excellent,Neutral (6.5–8.5)
3847,RIVER  NARMADA  AT DHARAMPURI,MADHYA PRADESH,20.0,21.5,6.9,8.5,7.6,8.5,240.0,404.0,1.1,1.2,0.68,1.08,3538.5852697095434,94402.99494284726,32.0,48.0,2022,3,Good,Neutral (6.5–8.5)
4577,"RIVER   NARMADA  AT CHANDANGHAT NEAR  ROAD  BRIDGE, DINDORI",MADHYA PRADESH,21.0,30.5,7.0,8.3,7.79,8.22,206.0,718.0,1.1,1.5,0.7343646138807429,0.4,3538.5852697095434,94402.99494284726,31.0,50.0,2022,3,Good,Neutral (6.5–8.5)
4579,"RIVER  NARMADA  AT DINDORI  D/S  AFTER MIXING       TO       CITY DOMESTIC           NEAR
JOGOTIKARIA GHAT",MADHYA PRADESH,21.0,30.2,6.8,8.6,7.76,8.32,242.0,3682.0,1.4,2.0,0.32,0.64,3538.5852697095434,94402.99494284726,47.0,70.0,2022,3,Good,Neutral (6.5–8.5)
4580,"RIVER          NARMADA
NEAR              BHAIRAV
TAMPLE                     AT SHHASTRADHARA MANDLA",MADHYA PRADESH,18.2,23.9,7.6,8.1,7.3,8.23,188.0,331.0,1.3,1.8,0.27,1.0,2.0,6.0,25.0,120.0,2022,4,Excellent,Neutral (6.5–8.5)
4581,"RIVER          NARMADA NEAR   ROAD   BRIDGE
(D/S     BARGI     DAM) JABALPUR",MADHYA PRADESH,18.3,22.6,7.2,8.1,7.26,8.61,258.0,347.0,1.2,1.8,0.7343646138807429,1.0,3.0,6.0,31.0,84.0,2022,3,Good,Neutral (6.5–8.5)
4582,"RIVER  NARMADA  AT JAMTARA,            NEAR
RAILWAY BRIDGE",MADHYA PRADESH,18.2,23.3,7.0,8.3,7.18,8.27,230.0,377.0,1.1,1.8,0.14,1.0,3.0,6.0,27.0,84.0,2022,4,Excellent,Neutral (6.5–8.5)
4583,RIVER          NARMADA NEAR   ROAD   BRIDGE JHANSINGHAT JABALPUR,MADHYA PRADESH,18.2,25.3,7.5,8.2,7.31,8.44,198.0,340.0,1.1,1.9,0.29,1.34,3538.5852697095434,94402.99494284726,17.0,47.0,2022,3,Good,Neutral (6.5–8.5)
4584,"RIVER NARMADA N.H.
44        NEAR        ROAD BRIDGE  AT  BARMAN. JABALPUR",MADHYA PRADESH,18.3,25.3,7.3,8.6,7.3,8.8,212.0,302.0,1.2,1.8,0.27,1.0,3538.5852697095434,94402.99494284726,17.0,170.0,2022,2,Moderate,Neutral (6.5–8.5)
4585,"RIVER         NARMADA, BARMANGHAT,      100 MDS OF MAINGHAT",MADHYA PRADESH,1.6,25.2,7.4,8.1,7.3,8.6,215.0,328.0,1.3,1.8,0.28,1.4,2.0,2.7,17.0,190.0,2022,3,Good,Neutral (6.5–8.5)
4586,"RIVER NARMADA S.N.
44        NEAR        ROAD BRIDGE                 NEAR JHILKOLI NARSINGPUR",MADHYA PRADESH,18.1,25.3,7.3,8.0,7.3,8.2,204.0,306.0,1.1,1.9,0.29,1.6,2.0,2.0,17.0,63.0,2022,4,Excellent,Neutral (6.5–8.5)
4587,"RIVER  NARMADA  AT NEAR  ROAD  BRIDGE, SANDIA",MADHYA PRADESH,18.0,29.0,7.3,8.5,7.72,8.18,220.0,298.0,1.1,1.6,1.03,2.23,17.0,70.0,23.0,350.0,2022,4,Excellent,Neutral (6.5–8.5)
4588,"RIVER NARMADA   AT UP-       STREAM       OF VILLAGE   JAIT   NEAR NARYANAPURA
DISTRICT SEHORE",MADHYA PRADESH,16.0,31.0,5.2,9.7,7.61,8.15,176.0,367.0,1.1,1.8,1.72,8.94,2.0,58.0,58.0,350.0,2022,4,Excellent,Neutral (6.5–8.5)
4589,RIVER  NARMADA  AT D/S OF VILL. JAIT,MADHYA PRADESH,17.0,32.0,5.2,9.2,7.31,8.28,179.0,366.0,1.1,2.3,1.49,12.28,3.0,39.0,84.0,220.0,2022,4,Excellent,Neutral (6.5–8.5)
4590,RIVER  NARMADA  AT UP-STREAM   BEFORE CONFLUENCE           OF RIVER    TAWA    NEAR BANDRABHAN DISTRICT SEHORE,MADHYA PRADESH,17.0,31.0,5.7,9.3,7.21,8.24,178.0,371.0,1.2,1.6,1.53,12.24,2.0,63.0,79.0,350.0,2022,4,Excellent,Neutral (6.5–8.5)
4591,"RIVER  NARMADA  AT DOWN-STREAM AFTER   CONFLUENCE OF       RIVER       TAWA NEAR RAMNAGAR,DISTRICT SEHORE (M.P.)",MADHYA PRADESH,18.0,31.0,5.6,10.2,7.17,8.32,179.0,354.0,1.1,1.6,1.52,8.94,3.6,84.0,110.0,350.0,2022,4,Excellent,Neutral (6.5–8.5)
4592,"RIVER  NARMADA  AT BUDHNIGHAT, BUDHNI        DISTRICT SEHORE( M.P.)",MADHYA PRADESH,17.0,33.0,5.1,10.0,7.3,8.18,202.0,386.0,1.1,1.6,0.33,16.56,2.0,58.0,70.0,350.0,2022,4,Excellent,Neutral (6.5–8.5)
4593,"RIVER  NARMADA  AT DOWN-STREAM      OF TEXTILE                UNIT VILLAGE.    HOLIPURA BUDNI           DISTRICT
SEHORE (M.P.)",MADHYA PRADESH,16.0,32.0,5.8,9.9,7.36,8.23,174.0,395.0,1.1,1.7,1.44,7.91,3.0,63.0,130.0,430.0,2022,4,Excellent,Neutral (6.5–8.5)
4596,RIVER  NARMADA  AT HANUWANTIA    DIST. KHANDWA,MADHYA PRADESH,20.0,21.5,7.0,8.4,8.04,8.5,220.0,308.0,1.1,1.1,0.55,1.22,3538.5852697095434,94402.99494284726,32.0,46.0,2022,3,Good,Neutral (6.5–8.5)
4597,RIVER  NARMADA  AT U/S OMKAREWHWAR DAM KHANDWA,MADHYA PRADESH,20.0,21.5,6.8,8.4,7.66,8.5,220.0,307.0,1.1,1.1,0.5,0.98,3538.5852697095434,94402.99494284726,33.0,48.0,2022,3,Good,Neutral (6.5–8.5)
4598,"RIVER          NARMADA
RIVER                          AT
DHARESHWAR",MADHYA PRADESH,19.0,21.5,7.0,8.3,8.0,8.45,226.0,336.0,1.1,1.2,0.43,1.05,3538.5852697095434,94402.99494284726,33.0,49.0,2022,3,Good,Neutral (6.5–8.5)
4599,RIVER          NARMADA NEAR    W/S    INTAKE JALLOD,MADHYA PRADESH,20.0,21.5,7.0,8.4,8.0,8.5,213.0,394.0,2.6251969852689276,5.892971727105102,0.44,1.08,3538.5852697095434,94402.99494284726,31.0,48.0,2022,2,Moderate,Neutral (6.5–8.5)
4600,"RIVER          NARMADA
RIVER                          AT
SHAHASTRADHARA (JALKOTI)",MADHYA PRADESH,20.0,22.0,6.6,8.4,7.52,8.5,276.0,408.0,1.1,1.1,0.51,0.92,3538.5852697095434,94402.99494284726,4.0,49.0,2022,3,Good,Neutral (6.5–8.5)
